{
  "schema_version": 1,
  "repository": "globalpocket/brownie",
  "roles": {
    "implementation": {
      "github_login": "brownie-agent",
      "branch_prefixes": [
        "brownie-agent/",
        "phase-loop/"
      ],
      "require_fork_owner_match": true
    },
    "review": {
      "github_login": "globalpocket"
    },
    "merge": {
      "github_login": "globalpocket"
    }
  },
  "constraints": {
    "require_independent_review": true
  }
}
